Subject,Class,Unit,Theme,Sub-Theme,File_Path,Book_Section_Heading,Subtopic
SAT Reading,High School,Vocabulary in Context,Vocabulary,Contextual Meaning,data/english/the-complete-guide-to-sat-reading_compress.txt,Vocabulary in Context,Strategies for vocabulary-in-context questions
SAT Reading,High School,Vocabulary in Context,Vocabulary,Contextual Meaning,data/english/the-complete-guide-to-sat-reading_compress.txt,Vocabulary in Context,Plugging in your own word technique
SAT Reading,High School,Vocabulary in Context,Vocabulary,Contextual Meaning,data/english/the-complete-guide-to-sat-reading_compress.txt,Vocabulary in Context,Plugging each answer choice into sentence
SAT Reading,High School,Vocabulary in Context,Vocabulary,Contextual Meaning,data/english/the-complete-guide-to-sat-reading_compress.txt,Vocabulary in Context,Playing positive/negative with vocabulary questions
SAT Reading,High School,Vocabulary in Context,Vocabulary,Contextual Meaning,data/english/the-complete-guide-to-sat-reading_compress.txt,Vocabulary in Context,Second meanings of common words
SAT Reading,High School,Vocabulary in Context,Vocabulary,Contextual Meaning,data/english/the-complete-guide-to-sat-reading_compress.txt,Vocabulary in Context,Common second meanings list
SAT Reading,High School,Vocabulary in Context,Vocabulary,Contextual Meaning,data/english/the-complete-guide-to-sat-reading_compress.txt,Vocabulary in Context,Additional vocabulary words to know
SAT Reading,High School,Vocabulary in Context,Vocabulary,Contextual Meaning,data/english/the-complete-guide-to-sat-reading_compress.txt,Vocabulary in Context,Vocabulary in context exercises
SAT Reading,High School,Making the Leap: From Concrete to Abstract,Comprehension,Pronouns & Abstract Nouns,data/english/the-complete-guide-to-sat-reading_compress.txt,Making the Leap: From Concrete to Abstract,Understanding pronoun usage
SAT Reading,High School,Making the Leap: From Concrete to Abstract,Comprehension,Pronouns & Abstract Nouns,data/english/the-complete-guide-to-sat-reading_compress.txt,Making the Leap: From Concrete to Abstract,Compression nouns and abstract references
SAT Reading,High School,Making the Leap: From Concrete to Abstract,Comprehension,Pronouns & Abstract Nouns,data/english/the-complete-guide-to-sat-reading_compress.txt,Making the Leap: From Concrete to Abstract,The former and the latter usage
SAT Reading,High School,Making the Leap: From Concrete to Abstract,Comprehension,Pronouns & Abstract Nouns,data/english/the-complete-guide-to-sat-reading_compress.txt,Making the Leap: From Concrete to Abstract,Pronoun and compression noun exercises
SAT Reading,High School,The Big Picture,Comprehension,Main Ideas,data/english/the-complete-guide-to-sat-reading_compress.txt,The Big Picture,Identifying passage topics
SAT Reading,High School,The Big Picture,Comprehension,Main Ideas,data/english/the-complete-guide-to-sat-reading_compress.txt,The Big Picture,Determining main point vs. describing content
SAT Reading,High School,The Big Picture,Comprehension,Main Ideas,data/english/the-complete-guide-to-sat-reading_compress.txt,The Big Picture,Point of a paragraph analysis
SAT Reading,High School,The Big Picture,Comprehension,Main Ideas,data/english/the-complete-guide-to-sat-reading_compress.txt,The Big Picture,Old idea vs. new idea framework
SAT Reading,High School,The Big Picture,Comprehension,Main Ideas,data/english/the-complete-guide-to-sat-reading_compress.txt,The Big Picture,Using old ideas to predict main point and attitude
SAT Reading,High School,The Big Picture,Comprehension,Main Ideas,data/english/the-complete-guide-to-sat-reading_compress.txt,The Big Picture,Fiction passages: identifying main point
SAT Reading,High School,The Big Picture,Comprehension,Main Ideas,data/english/the-complete-guide-to-sat-reading_compress.txt,The Big Picture,Order of events in passages
SAT Reading,High School,The Big Picture,Comprehension,Main Ideas,data/english/the-complete-guide-to-sat-reading_compress.txt,The Big Picture,Supporting examples: working backwards
SAT Reading,High School,The Big Picture,Comprehension,Main Ideas,data/english/the-complete-guide-to-sat-reading_compress.txt,The Big Picture,Main point vs. primary purpose distinction
SAT Reading,High School,The Big Picture,Comprehension,Main Ideas,data/english/the-complete-guide-to-sat-reading_compress.txt,The Big Picture,The big picture exercises
SAT Reading,High School,Supporting Evidence,Comprehension,Evidence & Claims,data/english/the-complete-guide-to-sat-reading_compress.txt,Supporting Evidence,Supporting and contradicting claims
SAT Reading,High School,Supporting Evidence,Comprehension,Evidence & Claims,data/english/the-complete-guide-to-sat-reading_compress.txt,Supporting Evidence,Supporting evidence question types
SAT Reading,High School,Supporting Evidence,Comprehension,Evidence & Claims,data/english/the-complete-guide-to-sat-reading_compress.txt,Supporting Evidence,Supporting and contradicting claims exercises
SAT Reading,High School,Literal Comprehension,Comprehension,Literal Comprehension,data/english/the-complete-guide-to-sat-reading_compress.txt,Literal Comprehension,"Same idea, different words strategy"
SAT Reading,High School,Literal Comprehension,Comprehension,Literal Comprehension,data/english/the-complete-guide-to-sat-reading_compress.txt,Literal Comprehension,Other approaches to literal comprehension
SAT Reading,High School,Literal Comprehension,Comprehension,Literal Comprehension,data/english/the-complete-guide-to-sat-reading_compress.txt,Literal Comprehension,Using line references for educated guesses
SAT Reading,High School,Literal Comprehension,Comprehension,Literal Comprehension,data/english/the-complete-guide-to-sat-reading_compress.txt,Literal Comprehension,Literal comprehension exercises
SAT Reading,High School,Reasonable Inferences,Comprehension,Inference,data/english/the-complete-guide-to-sat-reading_compress.txt,Reasonable Inferences,Drawing reasonable inferences
SAT Reading,High School,Reasonable Inferences,Comprehension,Inference,data/english/the-complete-guide-to-sat-reading_compress.txt,Reasonable Inferences,Fallacies and incorrect answers in inference questions
SAT Reading,High School,Reasonable Inferences,Comprehension,Inference,data/english/the-complete-guide-to-sat-reading_compress.txt,Reasonable Inferences,Unstated assumptions
SAT Reading,High School,Reasonable Inferences,Comprehension,Inference,data/english/the-complete-guide-to-sat-reading_compress.txt,Reasonable Inferences,Inference exercises
SAT Reading,High School,Extended Reasoning and Analogies,Comprehension,Extended Reasoning,data/english/the-complete-guide-to-sat-reading_compress.txt,Extended Reasoning and Analogies,Extended reasoning questions
SAT Reading,High School,Extended Reasoning and Analogies,Comprehension,Extended Reasoning,data/english/the-complete-guide-to-sat-reading_compress.txt,Extended Reasoning and Analogies,Analogy questions
SAT Reading,High School,Extended Reasoning and Analogies,Comprehension,Extended Reasoning,data/english/the-complete-guide-to-sat-reading_compress.txt,Extended Reasoning and Analogies,Extended reasoning and analogy exercises
SAT Reading,High School,Reading for Function,Rhetorical Analysis,Function Questions,data/english/the-complete-guide-to-sat-reading_compress.txt,Reading for Function,Types of function questions
SAT Reading,High School,Reading for Function,Rhetorical Analysis,Function Questions,data/english/the-complete-guide-to-sat-reading_compress.txt,Reading for Function,Functions of key words and punctuation
SAT Reading,High School,Reading for Function,Rhetorical Analysis,Function Questions,data/english/the-complete-guide-to-sat-reading_compress.txt,Reading for Function,Vague answers in function questions
SAT Reading,High School,Reading for Function,Rhetorical Analysis,Function Questions,data/english/the-complete-guide-to-sat-reading_compress.txt,Reading for Function,Playing positive/negative with function questions
SAT Reading,High School,Reading for Function,Rhetorical Analysis,Function Questions,data/english/the-complete-guide-to-sat-reading_compress.txt,Reading for Function,Common function words and phrases
SAT Reading,High School,Reading for Function,Rhetorical Analysis,Function Questions,data/english/the-complete-guide-to-sat-reading_compress.txt,Reading for Function,Reading for function exercises
SAT Reading,High School,Reading for Function,Rhetorical Analysis,Function Questions,data/english/the-complete-guide-to-sat-reading_compress.txt,Reading for Function,Glossary of function words
SAT Reading,High School,Tone and Attitude,Rhetorical Analysis,Tone & Attitude,data/english/the-complete-guide-to-sat-reading_compress.txt,Tone and Attitude,Neutral tone with definite opinion
SAT Reading,High School,Tone and Attitude,Rhetorical Analysis,Tone & Attitude,data/english/the-complete-guide-to-sat-reading_compress.txt,Tone and Attitude,Playing positive/negative with tone questions
SAT Reading,High School,Tone and Attitude,Rhetorical Analysis,Tone & Attitude,data/english/the-complete-guide-to-sat-reading_compress.txt,Tone and Attitude,Inferring attitude from text
SAT Reading,High School,Tone and Attitude,Rhetorical Analysis,Tone & Attitude,data/english/the-complete-guide-to-sat-reading_compress.txt,Tone and Attitude,Simplifying tone answers
SAT Reading,High School,Tone and Attitude,Rhetorical Analysis,Tone & Attitude,data/english/the-complete-guide-to-sat-reading_compress.txt,Tone and Attitude,Register: formal vs. informal
SAT Reading,High School,Tone and Attitude,Rhetorical Analysis,Tone & Attitude,data/english/the-complete-guide-to-sat-reading_compress.txt,Tone and Attitude,Certainty and uncertainty indicators
SAT Reading,High School,Tone and Attitude,Rhetorical Analysis,Tone & Attitude,data/english/the-complete-guide-to-sat-reading_compress.txt,Tone and Attitude,"Humor, sarcasm, and irony"
SAT Reading,High School,Tone and Attitude,Rhetorical Analysis,Tone & Attitude,data/english/the-complete-guide-to-sat-reading_compress.txt,Tone and Attitude,Common tone and attitude words
SAT Reading,High School,Tone and Attitude,Rhetorical Analysis,Tone & Attitude,data/english/the-complete-guide-to-sat-reading_compress.txt,Tone and Attitude,Tone and attitude exercises
SAT Reading,High School,Rhetorical Strategy,Rhetorical Analysis,Rhetorical Strategy,data/english/the-complete-guide-to-sat-reading_compress.txt,Rhetorical Strategy,Point of view analysis
SAT Reading,High School,Rhetorical Strategy,Rhetorical Analysis,Rhetorical Strategy,data/english/the-complete-guide-to-sat-reading_compress.txt,Rhetorical Strategy,Paragraph and passage organization
SAT Reading,High School,Rhetorical Strategy,Rhetorical Analysis,Rhetorical Strategy,data/english/the-complete-guide-to-sat-reading_compress.txt,Rhetorical Strategy,Counterarguments in passages
SAT Reading,High School,Rhetorical Strategy,Rhetorical Analysis,Rhetorical Strategy,data/english/the-complete-guide-to-sat-reading_compress.txt,Rhetorical Strategy,Effect of rhetorical strategy
SAT Reading,High School,Rhetorical Strategy,Rhetorical Analysis,Rhetorical Strategy,data/english/the-complete-guide-to-sat-reading_compress.txt,Rhetorical Strategy,Rhetorical strategy exercises
SAT Reading,High School,Paired Passages,Comparative Reading,Paired Passages,data/english/the-complete-guide-to-sat-reading_compress.txt,Paired Passages,Overview of paired passages
SAT Reading,High School,Paired Passages,Comparative Reading,Paired Passages,data/english/the-complete-guide-to-sat-reading_compress.txt,Paired Passages,How to read paired passages
SAT Reading,High School,Paired Passages,Comparative Reading,Paired Passages,data/english/the-complete-guide-to-sat-reading_compress.txt,Paired Passages,Relationship questions as inference questions
SAT Reading,High School,Paired Passages,Comparative Reading,Paired Passages,data/english/the-complete-guide-to-sat-reading_compress.txt,Paired Passages,Paired passages and supporting evidence questions
SAT Reading,High School,Paired Passages,Comparative Reading,Paired Passages,data/english/the-complete-guide-to-sat-reading_compress.txt,Paired Passages,Agreement questions between passages
SAT Reading,High School,Paired Passages,Comparative Reading,Paired Passages,data/english/the-complete-guide-to-sat-reading_compress.txt,Paired Passages,Paired passage exercises
SAT Reading,High School,Graphics and Data Analysis,Data Analysis,Graphics Interpretation,data/english/the-complete-guide-to-sat-reading_compress.txt,Graphics and Data Analysis,Reading graphs: finding the point and skimming
SAT Reading,High School,Graphics and Data Analysis,Data Analysis,Graphics Interpretation,data/english/the-complete-guide-to-sat-reading_compress.txt,Graphics and Data Analysis,Reading between the lines in graphics
SAT Reading,High School,Graphics and Data Analysis,Data Analysis,Graphics Interpretation,data/english/the-complete-guide-to-sat-reading_compress.txt,Graphics and Data Analysis,Multiple variables in graphics
SAT Reading,High School,Graphics and Data Analysis,Data Analysis,Graphics Interpretation,data/english/the-complete-guide-to-sat-reading_compress.txt,Graphics and Data Analysis,Backwards graphs and trick answers
SAT Reading,High School,Graphics and Data Analysis,Data Analysis,Graphics Interpretation,data/english/the-complete-guide-to-sat-reading_compress.txt,Graphics and Data Analysis,Interpreting tables
SAT Reading,High School,Graphics and Data Analysis,Data Analysis,Graphics Interpretation,data/english/the-complete-guide-to-sat-reading_compress.txt,Graphics and Data Analysis,Paired graphics questions
SAT Reading,High School,Graphics and Data Analysis,Data Analysis,Graphics Interpretation,data/english/the-complete-guide-to-sat-reading_compress.txt,Graphics and Data Analysis,To synthesize or not decisions
SAT Reading,High School,Graphics and Data Analysis,Data Analysis,Graphics Interpretation,data/english/the-complete-guide-to-sat-reading_compress.txt,Graphics and Data Analysis,Graphics and extended reasoning
SAT Reading,High School,Graphics and Data Analysis,Data Analysis,Graphics Interpretation,data/english/the-complete-guide-to-sat-reading_compress.txt,Graphics and Data Analysis,Graphics and data analysis exercises
SAT Reading,High School,Introduction to SAT Reading,Test Strategy,General Approach,data/english/the-complete-guide-to-sat-reading_compress.txt,Introduction to SAT® Reading,What the SAT Reading test measures
SAT Reading,High School,Introduction to SAT Reading,Test Strategy,General Approach,data/english/the-complete-guide-to-sat-reading_compress.txt,Introduction to SAT® Reading,Managing the Reading Test as a whole
SAT Reading,High School,Introduction to SAT Reading,Test Strategy,General Approach,data/english/the-complete-guide-to-sat-reading_compress.txt,Introduction to SAT® Reading,The answer isn't always in the passage
SAT Reading,High School,Introduction to SAT Reading,Test Strategy,General Approach,data/english/the-complete-guide-to-sat-reading_compress.txt,Introduction to SAT® Reading,Understanding answer choices patterns
SAT Reading,High School,Introduction to SAT Reading,Test Strategy,General Approach,data/english/the-complete-guide-to-sat-reading_compress.txt,Introduction to SAT® Reading,Understanding line references
SAT Reading,High School,Introduction to SAT Reading,Test Strategy,General Approach,data/english/the-complete-guide-to-sat-reading_compress.txt,Introduction to SAT® Reading,Strategies for reading passages
SAT Reading,High School,Introduction to SAT Reading,Test Strategy,General Approach,data/english/the-complete-guide-to-sat-reading_compress.txt,Introduction to SAT® Reading,Skimming effectively
SAT Reading,High School,Introduction to SAT Reading,Test Strategy,General Approach,data/english/the-complete-guide-to-sat-reading_compress.txt,Introduction to SAT® Reading,Using key words for questions without line references
SAT Reading,High School,Introduction to SAT Reading,Test Strategy,General Approach,data/english/the-complete-guide-to-sat-reading_compress.txt,Introduction to SAT® Reading,How to work through questions with line references
SAT Reading,High School,Introduction to SAT Reading,Test Strategy,General Approach,data/english/the-complete-guide-to-sat-reading_compress.txt,Introduction to SAT® Reading,General tips for reading preparation
SAT Reading,High School,How to Use This Book,Test Strategy,Study Plan,data/english/the-complete-guide-to-sat-reading_compress.txt,How to Use This Book,Step-by-step study approach
SAT Reading,High School,How to Use This Book,Test Strategy,Study Plan,data/english/the-complete-guide-to-sat-reading_compress.txt,How to Use This Book,Identifying focus areas from diagnostic tests
SAT Reading,High School,How to Use This Book,Test Strategy,Study Plan,data/english/the-complete-guide-to-sat-reading_compress.txt,How to Use This Book,Building a bridge to the actual test
SAT Reading,High School,How to Use This Book,Test Strategy,Study Plan,data/english/the-complete-guide-to-sat-reading_compress.txt,How to Use This Book,Reviewing mistakes effectively
SAT Reading,High School,Suggested Reading,Content Knowledge,Background Resources,data/english/the-complete-guide-to-sat-reading_compress.txt,Suggested Reading,Recommended publications for SAT preparation
SAT Reading,High School,Suggested Reading,Content Knowledge,Background Resources,data/english/the-complete-guide-to-sat-reading_compress.txt,Suggested Reading,Fiction authors to familiarize with
SAT Reading,High School,Suggested Reading,Content Knowledge,Background Resources,data/english/the-complete-guide-to-sat-reading_compress.txt,Suggested Reading,Key topics and controversies in natural science
SAT Reading,High School,Suggested Reading,Content Knowledge,Background Resources,data/english/the-complete-guide-to-sat-reading_compress.txt,Suggested Reading,Key topics and controversies in social science
SAT Reading,High School,Suggested Reading,Content Knowledge,Background Resources,data/english/the-complete-guide-to-sat-reading_compress.txt,Suggested Reading,Science and social science authors
SAT Reading,High School,Suggested Reading,Content Knowledge,Background Resources,data/english/the-complete-guide-to-sat-reading_compress.txt,Suggested Reading,Key historical movements and figures
SAT Reading,High School,Suggested Reading,Content Knowledge,Background Resources,data/english/the-complete-guide-to-sat-reading_compress.txt,Suggested Reading,Historical documents and sources
Math,HSSC 1,Complex Numbers,Mathematics,Algebra / Complex Numbers,data/math/v3-11-maths-book-2025.txt,Complex Number,"Definition of complex number (z = a + ib or (a,b))"
Math,HSSC 1,Complex Numbers,Mathematics,Algebra / Complex Numbers,data/math/v3-11-maths-book-2025.txt,Complex Number,Euler’s notation for the imaginary unit (i = √-1 and i² = -1)
Math,HSSC 1,Complex Numbers,Mathematics,Algebra / Complex Numbers,data/math/v3-11-maths-book-2025.txt,Real and Imaginary Parts of a Complex Number,Recognizing real (Re(z)) and imaginary (Im(z)) parts
Math,HSSC 1,Complex Numbers,Mathematics,Algebra / Complex Numbers,data/math/v3-11-maths-book-2025.txt,Real and Imaginary Parts of a Complex Number,Definition of pure imaginary and real numbers
Math,HSSC 1,Complex Numbers,Mathematics,Algebra / Complex Numbers,data/math/v3-11-maths-book-2025.txt,Condition for the Equality of Two Complex Numbers,Condition for equality (z₁ = z₂ ⟺ x₁ = x₂ and y₁ = y₂)
Math,HSSC 1,Complex Numbers,Mathematics,Algebra / Complex Numbers,data/math/v3-11-maths-book-2025.txt,Basic Algebraic Operations on Complex Numbers,Basic algebraic operations overview
Math,HSSC 1,Complex Numbers,Mathematics,Algebra / Complex Numbers,data/math/v3-11-maths-book-2025.txt,Addition of Two Complex Numbers,Addition of complex numbers (z₁ + z₂)
Math,HSSC 1,Complex Numbers,Mathematics,Algebra / Complex Numbers,data/math/v3-11-maths-book-2025.txt,Subtraction of Two Complex Numbers,Subtraction of complex numbers (z₁ - z₂)
Math,HSSC 1,Complex Numbers,Mathematics,Algebra / Complex Numbers,data/math/v3-11-maths-book-2025.txt,Product of Two Complex Numbers,Multiplication (Product) of complex numbers (z₁z₂)
Math,HSSC 1,Complex Numbers,Mathematics,Algebra / Complex Numbers,data/math/v3-11-maths-book-2025.txt,Division of Complex Numbers,Division of complex numbers (rationalization using conjugate)
Math,HSSC 1,Complex Numbers,Mathematics,Algebra / Complex Numbers,data/math/v3-11-maths-book-2025.txt,Conjugate of a Complex Number,Definition of complex conjugate (z̄ = x - iy)
Math,HSSC 1,Complex Numbers,Mathematics,Algebra / Complex Numbers,data/math/v3-11-maths-book-2025.txt,Conjugate of a Complex Number,Geometric interpretation of the conjugate (mirror image about x-axis)
Math,HSSC 1,Complex Numbers,Mathematics,Algebra / Complex Numbers,data/math/v3-11-maths-book-2025.txt,Magnitude or Modulus of a Complex Number,Definition of magnitude/modulus (|z| = √(x² + y²))
Math,HSSC 1,Complex Numbers,Mathematics,Algebra / Complex Numbers,data/math/v3-11-maths-book-2025.txt,Magnitude or Modulus of a Complex Number,Geometric interpretation of modulus (distance from origin)
Math,HSSC 1,Complex Numbers,Mathematics,Algebra / Complex Numbers,data/math/v3-11-maths-book-2025.txt,Magnitude or Modulus of a Complex Number,"Properties of Modulus (|z| ≥ 0, |z| = 0 ⟺ z = 0)"
Math,HSSC 1,Complex Numbers,Mathematics,Algebra / Complex Numbers,data/math/v3-11-maths-book-2025.txt,Real and Imaginary Parts of the Complex Numbers of the Types,"Extracting Real and Imaginary parts of zⁿ (for n = 1, -1, 2, -2)"
Math,HSSC 1,Complex Numbers,Mathematics,Algebra / Complex Numbers,data/math/v3-11-maths-book-2025.txt,Real and Imaginary Parts of the Complex Numbers of the Types,"Extracting Real and Imaginary parts of z₁/z₂ (for n = 1, -1)"
Math,HSSC 1,Complex Numbers,Mathematics,Algebra / Complex Numbers,data/math/v3-11-maths-book-2025.txt,Solution of Equations,Solving simultaneous linear equations with complex coefficients
Math,HSSC 1,Complex Numbers,Mathematics,Algebra / Complex Numbers,data/math/v3-11-maths-book-2025.txt,Solution of Equations,Solving quadratic equations by completing the square
Math,HSSC 1,Complex Numbers,Mathematics,Algebra / Complex Numbers,data/math/v3-11-maths-book-2025.txt,Complex Polynomial and Factorization,"Factorizing polynomials using complex roots (e.g., z² + a²)"
Math,HSSC 1,Complex Numbers,Mathematics,Algebra / Complex Numbers,data/math/v3-11-maths-book-2025.txt,Complex Polynomial and Factorization,Writing a polynomial P(z) as a product of linear factors
Math,HSSC 1,Complex Numbers,Mathematics,Algebra / Complex Numbers,data/math/v3-11-maths-book-2025.txt,Polar Coordinate System,Explanation of the polar coordinate system
Math,HSSC 1,Complex Numbers,Mathematics,Algebra / Complex Numbers,data/math/v3-11-maths-book-2025.txt,Polar Form and Properties,Description of the polar representation of a complex number
Math,HSSC 1,Complex Numbers,Mathematics,Algebra / Complex Numbers,data/math/v3-11-maths-book-2025.txt,Polar Form and Properties,Conversion between algebraic and polar form
Math,HSSC 1,Complex Numbers,Mathematics,Algebra / Complex Numbers,data/math/v3-11-maths-book-2025.txt,Polar Form and Properties,Applying basic operations with complex numbers in polar representation
Math,HSSC 1,Complex Numbers,Mathematics,Algebra / Complex Numbers,data/math/v3-11-maths-book-2025.txt,Polar Form and Properties,De Moivre’s theorem and its applications
Math,HSSC 1,Complex Numbers,Mathematics,Algebra / Complex Numbers,data/math/v3-11-maths-book-2025.txt,Polar Form and Properties,nth roots of complex numbers
Math,HSSC 1,Complex Numbers,Mathematics,Algebra / Complex Numbers,data/math/v3-11-maths-book-2025.txt,Polar Form and Properties,Roots of unity (geometric interpretation)
Math,HSSC 1,Complex Numbers,Mathematics,Algebra / Complex Numbers,data/math/v3-11-maths-book-2025.txt,Applications,"Applications of complex numbers (e.g., cryptography, wave phenomena, circuits)"
Math,HSSC 1,Matrices and Determinants,Mathematics,Algebra / Linear Algebra,data/math/v3-11-maths-book-2025.txt,Introduction to Matrices,Constructing a matrix (A=(aᵢⱼ))
Math,HSSC 1,Matrices and Determinants,Mathematics,Algebra / Linear Algebra,data/math/v3-11-maths-book-2025.txt,Types of Matrices,Diagonal matrix
Math,HSSC 1,Matrices and Determinants,Mathematics,Algebra / Linear Algebra,data/math/v3-11-maths-book-2025.txt,Types of Matrices,Triangular matrix (Upper and Lower)
Math,HSSC 1,Matrices and Determinants,Mathematics,Algebra / Linear Algebra,data/math/v3-11-maths-book-2025.txt,Types of Matrices,Unit (Identity) matrix
Math,HSSC 1,Matrices and Determinants,Mathematics,Algebra / Linear Algebra,data/math/v3-11-maths-book-2025.txt,Types of Matrices,Zero matrix
Math,HSSC 1,Matrices and Determinants,Mathematics,Algebra / Linear Algebra,data/math/v3-11-maths-book-2025.txt,Equality and Operations,Condition for the equality of matrices
Math,HSSC 1,Matrices and Determinants,Mathematics,Algebra / Linear Algebra,data/math/v3-11-maths-book-2025.txt,Determinants of Matrices,Determinant of a 2x2 matrix
Math,HSSC 1,Matrices and Determinants,Mathematics,Algebra / Linear Algebra,data/math/v3-11-maths-book-2025.txt,Determinants of Matrices,Calculating cofactors and adjoint of a matrix
Math,HSSC 1,Matrices and Determinants,Mathematics,Algebra / Linear Algebra,data/math/v3-11-maths-book-2025.txt,Properties of Determinants,Applying row/column operations to simplify determinants
Math,HSSC 1,Matrices and Determinants,Mathematics,Algebra / Linear Algebra,data/math/v3-11-maths-book-2025.txt,Inverse of a Matrix,Calculating the inverse of a matrix
Math,HSSC 1,Matrices and Determinants,Mathematics,Algebra / Linear Algebra,data/math/v3-11-maths-book-2025.txt,Solution of Linear Systems,Solving linear systems using matrices (Cramer's Rule or Matrix Inverse Method)
